seccion,titulo,descripcion,enlace,fecha
general,Takeaways from Thunder-Lakers Game 4,Here's what we've learned -- and what's next for the Cavs-Pistons and the Wolves-Spurs series.,https://www.espn.com/nba/story/_/id/48676289/2026-nba-playoffs-conference-semifinals-round-2-takeaways,"Tue, 12 May 2026 02:05:06 EST"
general,LeBron: 'I don't know what the future holds',"LeBron James, whose record-setting 23rd season ended with an unceremonious 115-110 loss to the Thunder in Game 4 of a second-round sweep of the Lakers, was noncommittal about whether he will continue playing in L.A. -- or elsewhere.",https://www.espn.com/nba/story/_/id/48747842/lakers-lebron-james-know-future-holds-me,"Tue, 12 May 2026 07:00:09 EST"
general,OKC escapes late L.A. charge to complete sweep,"The Lakers refused to fold while facing elimination, but the Thunder ultimately pulled away to improve to 8-0 this postseason.",https://www.espn.com/nba/story/_/id/48747206/thunder-escape-late-lakers-charge-complete-sweep,"Tue, 12 May 2026 07:00:09 EST"
general,Bickerstaff calls FT disparity in loss 'unacceptab...,"Pistons coach J.B. Bickerstaff called the gulf in attempted free throws between his team and the Cavaliers in Monday's Game 4 loss ""unacceptable.""",https://www.espn.com/nba/story/_/id/48747058/bickerstaff-calls-ft-disparity-game-4-loss-unacceptable,"Tue, 12 May 2026 07:00:09 EST"
general,Mitchell's record-tying 2nd half evens East semis,"Donovan Mitchell tied an NBA playoff record with 39 points in the second half, and the Cavaliers evened their second-round series against the Pistons with a 112-103 victory Monday night.",https://www.espn.com/nba/story/_/id/48746487/donovan-mitchell-ties-nba-playoff-record-39-points-second-half-cavaliers-even-series-vs-pistons,"Tue, 12 May 2026 07:00:09 EST"
general,Kiffin: LSU's 'diversity' recruiting edge vs. Rebe...,"LSU coach Lane Kiffin implied the lack of diversity at Ole Miss hurt his ability to recruit players, saying parents have told him Baton Rouge feels more reflective of the ""real world.""",https://www.espn.com/college-football/story/_/id/48744747/kiffin-lsu-diversity-recruitment-advantage-vs-ole-miss,"Tue, 12 May 2026 07:00:09 EST"
general,Wild's McCarron labels Avs' Manson 'a dirty player...,Avalanche defenseman Josh Manson returned from a five-game absence Monday night in Game 4 and took a double minor penalty for hitting Wild center Michael McCarron with the blunt end of his stick during a scrum midway through the first period.,https://www.espn.com/nhl/story/_/id/48747287/wild-michael-mccarron-calls-avalanche-josh-manson-dirty-player-butt-ending-face,"Tue, 12 May 2026 07:00:09 EST"
general,Sources: Struggling Mets call up prospect Ewing,"The Mets are calling up their No. 2 prospect, outfielder A.J. Ewing, in hopes of sparking a struggling offense.",https://www.espn.com/mlb/story/_/id/48746188/sources-struggling-mets-call-prospect-aj-ewing,"Tue, 12 May 2026 07:00:09 EST"
general,Bills to open new stadium in Week 2 vs. Lions,"The Bills will play their first regular-season game at their new home, the newly constructed Highmark Stadium, in Week 2 against the Lions, it was announced Monday.",https://www.espn.com/nfl/story/_/id/48744949/bills-play-first-regular-season-game-new-stadium-week-2,"Tue, 12 May 2026 07:00:09 EST"
general,"⚾ MLB free agency: Skubal status, top hitter, more...",We polled those around the industry about the most intriguing topics surrounding this upcoming offseason.,https://www.espn.com/mlb/story/_/id/48733848/mlb-2026-27-free-agency-offseason-questions-market-skubal-lockout-top-free-agent,"Tue, 12 May 2026 07:00:09 EST"
general,"The French Connection: Gobert, Wemby put their friendship on hold for the playoffs",The French big men have been friends for a decade and now face off against each other in a 2-2 series.,https://www.espn.com/nba/story/_/id/48742665/rivalry-friendship-rudy-gobert-victor-wembanyama-spurs-timberwolves-playoffs,"Tue, 12 May 2026 07:07:48 EST"
general,"Lucky socks, a fishhook and pickup hoops: How the ...",ESPN was granted behind-the-scenes access to Washington on the day the franchise secured the No. 1 pick of the 2026 NBA draft.,https://www.espn.com/nba/story/_/id/48742366/washington-wizards-nba-lottery-draft-2026-first-overall-pick-aj-dybantsa,"Tue, 12 May 2026 08:05:27 EST"
general,Windhorst: Everything I saw inside the NBA's myste...,Here's everything that transpired as the ping-pong balls were selected.,https://www.espn.com/nba/story/_/id/48737761/inside-secret-nba-lottery-room-ahead-2026-draft-picks-rounds-jokes-silence-ping-pong-balls,"Tue, 12 May 2026 08:05:26 EST"
general,"Wait, why didn't my NFL team ____? Reasonable answ...","Let's make sense of the Cowboys not extending George Pickens, the Steelers bypassing QB upgrades, the Dolphins not trading De'Von Achane and more.",https://www.espn.com/nfl/story/_/id/48742512/2026-nfl-offseason-10-teams-questions-explaining-missed-moves,"Tue, 12 May 2026 07:14:23 EST"
general,Three questions facing Lamar Jackson and the Raven...,"Heading into next week's organized team activities, the Ravens have some major questions to address.",https://www.espn.com/nfl/story/_/id/48741815/questions-facing-lamar-jackson-baltimore-ravens-ravens-center-tyler-linderbaum-nnamdi-madubuike,"Tue, 12 May 2026 07:14:23 EST"
general,Rich Rodriguez Q&A: The secret sauce at West Virgi...,"At his second go-around in Morgantown, Rodriguez notes how much has changed and what's stayed the same.",https://www.espn.com/college-football/story/_/id/48679548/west-virginia-rich-rodriguez-qa-college-football,"Tue, 12 May 2026 07:08:21 EST"
general,"CFB buzz: Army-Navy's future, last JMU Hoosier, la...",What we heard around college football after the completion of spring practice.,https://www.espn.com/college-football/story/_/id/48695281/college-football-spring-buzz-week-0-cfp-ohio-state-notre-dame-army-navy,"Tue, 12 May 2026 07:08:21 EST"
general,Why so many good teams have closer issues -- and h...,"Bullpens are more volatile than ever, and closers with a capital C are few and far between, even for baseball's elite.",https://www.espn.com/mlb/story/_/id/48742800/mlb-2026-closer-bullpen-struggles-impact-rest-season-deadline,"Tue, 12 May 2026 07:11:47 EST"
general,How two lefty sluggers are powering the best offen...,Matt Olson and Drake Baldwin headline a lineup that has the Braves running away with the NL East.,https://www.espn.com/mlb/story/_/id/48742605/mlb-2026-matt-olson-drake-baldwin-atlanta-braves-lineup-offsense-nl-east,"Tue, 12 May 2026 07:11:47 EST"
general,"PGA Championship tiers: Ranking favorites, contend...",Can Scottie Scheffler repeat? Will Rory McIlroy make it two straight majors? We break down the PGA Championship field from the favorites to the players just looking to make the cut.,https://www.espn.com/golf/story/_/page/PGArankings2026/2026-pga-championship-ranking-favorites-contenders-hopefuls,"Tue, 12 May 2026 06:40:29 EST"
general,"Latest news and analysis, how to watch and more fr...",The PGA Championship heads to Aronimink Golf Club outside of Philadelphia. Here's all the coverage.,https://www.espn.com/golf/story/_/page/PGAchampionship2026/pga-championship-2026-news-tee-s-schedule-television-complete-coverage-analysis,"Mon, 11 May 2026 14:14:23 EST"
general,'Blast from the past': How Taylor Hall found his M...,"The No. 1 pick (2010) and Hart Trophy winner (2018) is a critical player for the Canes, who have yet to lose this postseason.",https://www.espn.com/nhl/story/_/id/48743578/2026-nhl-playoffs-stanley-cup-taylor-hall-mvp-carolina-hurricanes,"Tue, 12 May 2026 07:07:36 EST"
general,"Stanley Cup playoffs daily: Sabres want revenge, p...","It's a crucial night on the calendar with an ESPN doubleheader. Plus, highlights from Avs-Wild Game 4.",https://www.espn.com/nhl/story/_/id/48526483/2026-nhl-playoffs-stanley-cup-preview-stats-schedule-top-players-bracket-matchups,"Tue, 12 May 2026 07:21:57 EST"
general,10 things we learned from the WNBA's opening weeke...,"Even with a short roster, New York is a front-runner, Phoenix has no shortage of talent, and the Dream are even better.",https://www.espn.com/wnba/story/_/id/48736313/wnba-2026-season-opener-takeaways-caitlin-clark-fever-wings-liberty-aces,"Mon, 11 May 2026 11:50:43 EST"
general,How Belmont's Maya Johnson managed lupus to become...,"The Bruins ace was turned away by major programs for medical reasons. Now, in the postseason, she's looking to beat them.",https://www.espn.com/college-sports/story/_/id/48740541/belmont-softball-maya-johnson-lupus,"Tue, 12 May 2026 07:09:52 EST"
general,Why a familiar summer awaits Joel Embiid and the 7...,"After a historic comeback gave way to a second-round sweep, the 76ers face another offseason of questions.",https://www.espn.com/nba/story/_/id/48622748/nba-playoffs-2026-embiid-76ers-face-familiar-offseason-knicks-sweep,"Mon, 11 May 2026 16:34:19 EST"
general,As it happened: Washington wins the No. 1 pick in the NBA 2026 draft lottery,Here is how the NBA 2026 draft lottery unfolded from Chicago on Sunday as the Wizards won the No. 1 pick.,https://www.espn.com/nba/story/_/id/48706896/nba-draft-lottery-2026-live-updates-moments,"Sun, 10 May 2026 15:49:57 EST"
general,Inside Real Madrid's downward spiral into infighti...,"In another season with no major trophy, Real Madrid have had to deal with players fighting and problems at team and boardroom level. How did it come to this?",https://www.espn.com/soccer/story/_/id/48739869/real-madrid-downward-spiral-infighting-disarray-no-trophies,"Tue, 12 May 2026 07:24:07 EST"
general,"How Barcelona won LaLiga title, and how they can g...","It will be hard to top sealing the title in El Clásico, but 2025-26 is a season that has left Barcelona wanting more.",https://www.espn.com/soccer/story/_/id/48739456/how-barcelona-won-laliga-how-get-even-better,"Tue, 12 May 2026 07:24:06 EST"
general,"Hat trick: Alex Morgan pregnant with third baby, e...","Former USWNT star Alex Morgan announced on Mother's Day that she and her partner, Servando Carrasco, are expecting their third child together.",https://www.espn.com/soccer/story/_/id/48738086/alex-morgan-third-baby-announcement-pregnancy,"Mon, 11 May 2026 23:46:10 EST"
general,Celebrities at the NBA playoffs: Leonardo DiCaprio...,Celebrities have been out in style courtside at the NBA playoffs.,https://www.espn.com/nba/story/_/id/48514336/nba-playoffs-2026-celebrity-sightings,"Mon, 11 May 2026 23:46:10 EST"
general,UFC 328 fight grades: Khamzat Chimaev vs. Sean Str...,"There were seven finishes on the UFC 328 card, but only one of them earned an A grade.",https://www.espn.com/mma/story/_/id/48736888/ufc-328-fight-grades-sean-strickland-khamzat-chimaev-joshua-van-tatsuro-taira,"Mon, 11 May 2026 12:36:39 EST"
general,What's next: Will Sean Strickland and Khamzat Chim...,"The most-likely next opponent -- and a few wild cards -- for the winners, losers from the UFC 328 main card.",https://www.espn.com/mma/story/_/id/48728899/ufc-328-whats-next-sean-strickland-khamzat-chimaev-run-back,"Mon, 11 May 2026 12:36:39 EST"
general,"Week 13 in college baseball: Top 25, best moments ...",What do the latest top 25 rankings look like?,https://www.espn.com/college-sports/story/_/id/48740731/college-baseball-week-13-top-25-rankings-top-player-game-watch-2026,"Mon, 11 May 2026 15:52:21 EST"
general,"Softball: NCAA tournament scores, schedule, watch",Everything you need to know about the softball postseason is here.,https://www.espn.com/college-sports/story/_/id/48734760/college-softball-2026-wcws-ncaa-tournament-watch-schedule-scores,"Mon, 11 May 2026 15:52:20 EST"
general,"WWE Backlash takeaways: Breakker's breakout, Reign...",WWE Backlash was defined by rising young stars and the intensifying feud between Roman Reigns and Jacob Fatu.,https://www.espn.com/wwe/story/_/id/48726269/wwe-backlash-takeaways-breakker-breakout-reigns-troubles-more,"Mon, 11 May 2026 07:58:25 EST"
general,MLS: NYCFC soar after Wolf's stellar hat trick,NYCFC were among the biggest risers in this week's edition of ESPN's MLS Power Rankings.,https://www.espn.com/soccer/story/_/id/48741643/mls-power-rankings-nycfc-soar-hannes-wolf-hat-trick,"Mon, 11 May 2026 13:35:08 EST"
general,"NWSL: San Diego takes top spot, Washington's strea...","Our new No. 1 in the ESPN's NWSL Power Rankings is the San Diego Wave, though the Washington Spirit's hot streak continues.",https://www.espn.com/soccer/story/_/id/48741480/nwsl-power-rankings-san-diego-wave-take-top-spot-washington-spirit-streaks-continue,"Mon, 11 May 2026 13:35:08 EST"
general,"Fans, managers can hate on VAR, but  David Raya in...","Arsenal boss Mikel Arteta is the embodiment of how football wants VAR to work both ways. But Sunday's decision was right, and isn't that what we all want?",https://www.espn.com/soccer/story/_/id/48739444/fans-managers-hate-var-raya-incident-why-exists,"Tue, 12 May 2026 07:56:24 EST"
general,Mexico unveil a rarity at 2026 World Cup: A third ...,Mexico have added a third kit to their impressively stylish World Cup wardrobe.,https://www.espn.com/soccer/story/_/id/48748977/mexico-unveil-third-alternate-kit-rarity-2026-fifa-world-cup,"Tue, 12 May 2026 07:56:24 EST"
general,Boxing divisional rankings: Dubois stays put at he...,Daniel Dubois keeps position at heavyweight; David Morrell no longer ranked at 175 pounds. Here are the latest ESPN divisional rankings.,https://www.espn.com/boxing/story/_/id/21675272/divisional-rankings-best-top-10-fighters-per-division,"Tue, 12 May 2026 07:59:19 EST"
general,Free agent pickups: Waldschmidt and Snelling get t...,The top players you should consider claiming off the fantasy baseball waiver wire this week.,https://www.espn.com/fantasy/baseball/story/_/id/48740286/fantasy-baseball-free-agent-pickups-waiver-wire-may11-2026,"Mon, 11 May 2026 11:28:13 EST"
general,Lineup advice: Four players to add after opening w...,"Andre Snellings recaps a busy opening weekend with surprises, standouts and four players to add to your lineup this week.",https://www.espn.com/fantasy/womens-basketball/story/_/id/48713412/espn-wnba-fantasy-womens-basketball-lineups-adds-drops-news-players,"Mon, 11 May 2026 15:38:54 EST"
general,"Transfer rumors, news: Liverpool look to Martinez ...",Liverpool's move to sign Aston Villa goalkeeper Emiliano Martinez is gaining momentum. Transfer Talk has the latest.,https://www.espn.com/soccer/story/_/id/48747741/transfer-rumors-news-liverpool-look-martinez-alisson-replacement,"Tue, 12 May 2026 05:51:44 EST"
nba,Takeaways from Thunder-Lakers Game 4,Here's what we've learned -- and what's next for the Cavs-Pistons and the Wolves-Spurs series.,https://www.espn.com/nba/story/_/id/48676289/2026-nba-playoffs-conference-semifinals-round-2-takeaways,"Tue, 12 May 2026 02:05:06 EST"
nba,LeBron: 'I don't know what the future holds',"LeBron James, whose record-setting 23rd season ended with an unceremonious 115-110 loss to the Thunder in Game 4 of a second-round sweep of the Lakers, was noncommittal about whether he will continue playing in L.A. -- or elsewhere.",https://www.espn.com/nba/story/_/id/48747842/lakers-lebron-james-know-future-holds-me,"Tue, 12 May 2026 07:00:09 EST"
nba,OKC escapes late L.A. charge to complete sweep,"The Lakers refused to fold while facing elimination, but the Thunder ultimately pulled away to improve to 8-0 this postseason.",https://www.espn.com/nba/story/_/id/48747206/thunder-escape-late-lakers-charge-complete-sweep,"Tue, 12 May 2026 04:21:10 EST"
nba,Mitchell's record-tying 2nd half evens East semis,"Donovan Mitchell tied an NBA playoff record with 39 points in the second half, and the Cavaliers evened their second-round series against the Pistons with a 112-103 victory Monday night.",https://www.espn.com/nba/story/_/id/48746487/donovan-mitchell-ties-nba-playoff-record-39-points-second-half-cavaliers-even-series-vs-pistons,"Tue, 12 May 2026 04:21:10 EST"
nba,Bickerstaff calls FT disparity in loss 'unacceptab...,"Pistons coach J.B. Bickerstaff called the gulf in attempted free throws between his team and the Cavaliers in Monday's Game 4 loss ""unacceptable.""",https://www.espn.com/nba/story/_/id/48747058/bickerstaff-calls-ft-disparity-game-4-loss-unacceptable,"Tue, 12 May 2026 04:21:10 EST"
nba,No discipline for Wemby elbow; he'll play Game 5,"Spurs star Victor Wembanyama will not face any further discipline for elbowing Minnesota's Naz Reid and will play in Game 5 against the Timberwolves in San Antonio, sources told ESPN.",https://www.espn.com/nba/story/_/id/48742211/no-discipline-wembanyama-reid-elbow-play-game-5,"Tue, 12 May 2026 04:21:10 EST"
nba,Sources: Bucks seeking trade offers for Giannis,"The Bucks are open for business on trade calls and offers for Giannis Antetokounmpo, sources told ESPN.",https://www.espn.com/nba/story/_/id/48741814/sources-bucks-seeking-trade-offers-giannis-antetokounmpo,"Tue, 12 May 2026 04:21:10 EST"
nba,Spurs' Fox (ankle) questionable for Game 5,The Spurs listed guard De'Aaron Fox as questionable for Tuesday's Game 5 of the Western Conference semifinals at Frost Bank Center because of right ankle soreness.,https://www.espn.com/nba/story/_/id/48746586/spurs-deaaron-fox-dealing-right-ankle-soreness,"Tue, 12 May 2026 04:21:10 EST"
nba,"🍼 LaOne: LaMelo, partner welcome first child","The couple also revealed they will be launching I Am Fertility, a nonprofit ""dedicated to supporting women navigating fertility and IVF journeys.""",https://www.espn.com/nba/story/_/id/48734873/lamelo-ball-birth-first-child-laone,"Tue, 12 May 2026 04:21:10 EST"
nba,"Copy of Lucky socks, a fishhook and pickup hoops: How the ...",ESPN was granted behind-the-scenes access to Washington on the day the franchise secured the No. 1 pick of the 2026 NBA draft.,https://www.espn.com/nba/story/_/id/48742366/washington-wizards-nba-lottery-draft-2026-first-overall-pick-aj-dybantsa,"Tue, 12 May 2026 08:05:45 EST"
nba,Copy of Windhorst: Everything I saw inside the NBA's myste...,Here's everything that transpired as the ping-pong balls were selected.,https://www.espn.com/nba/story/_/id/48737761/inside-secret-nba-lottery-room-ahead-2026-draft-picks-rounds-jokes-silence-ping-pong-balls,"Tue, 12 May 2026 08:05:45 EST"
nba,"The French Connection: Gobert, Wemby put their fri...",The French big men have been friends for a decade and now face off against each other in a 2-2 series.,https://www.espn.com/nba/story/_/id/48742665/rivalry-friendship-rudy-gobert-victor-wembanyama-spurs-timberwolves-playoffs,"Tue, 12 May 2026 07:48:28 EST"
nba,The Wizards have the No. 1 pick! Updated mock draf...,"The Wizards, Jazz and Grizzlies have the top picks in the 2026 NBA draft. Here's Jeremy Woo's updated mock.",https://www.espn.com/nba/story/_/id/48713262/2026-nba-mock-draft-pick-projections-picks-post-lottery-dybantsa-peterson,"Tue, 12 May 2026 08:05:15 EST"
nba,Copy of NBA combine primer: What to watch for and who coul...,"The NBA draft combine is here, with dozens of prospects competing to raise their stock. Here's what to know.",https://www.espn.com/nba/story/_/id/48694379/2026-nba-draft-combine-preview-players-workouts-watch-chicago-dybantsa-peterson-boozer-wilson,"Tue, 12 May 2026 08:05:15 EST"
nba,Latest NBA buzz: Everything we're hearing ahead of...,"Here's the latest news and reactions from our insiders, including Giannis' status with the Bucks.",https://www.espn.com/nba/story/_/id/48377855/2026-nba-buzz-latest-live-updates-news-intel-nba-draft-offseason,"Tue, 12 May 2026 02:02:18 EST"
nba,"Offseason guides: Draft, free agency, trade target...","What lies ahead for the Magic, Celtics, Nuggets, Warriors and every eliminated team?",https://www.espn.com/nba/story/_/id/48432907/nba-offseason-2026-draft-free-agency-trade-targets-30-teams,"Tue, 12 May 2026 02:10:47 EST"
nba,Why a familiar summer awaits Joel Embiid and the 7...,"After a historic comeback gave way to a second-round sweep, the 76ers face another offseason of health and roster questions.",https://www.espn.com/nba/story/_/id/48622748/nba-playoffs-2026-embiid-76ers-face-familiar-offseason-knicks-sweep,"Mon, 11 May 2026 11:17:40 EST"
nba,"Steve Kerr is back: Why he signed a new deal, and ...",Why did Kerr decide to return? How will this impact the Warriors' offseason? Here's everything you need to know about Kerr's new deal with Golden State.,https://www.espn.com/nba/story/_/id/48565081/steve-kerr-returning-golden-state-warriors-coach-answering-questions-next-offseason-moves,"Mon, 11 May 2026 16:03:33 EST"
nfl,"Wait, why didn't my NFL team ____? Reasonable answ...","Let's make sense of the Cowboys not extending George Pickens, the Steelers bypassing QB upgrades, the Dolphins not trading De'Von Achane and more.",https://www.espn.com/nfl/story/_/id/48742512/2026-nfl-offseason-10-teams-questions-explaining-missed-moves,"Tue, 12 May 2026 07:27:23 EST"
nfl,Bills to open new stadium in Week 2 vs. Lions,"The Bills will play their first regular-season game at their new home, the newly constructed Highmark Stadium, in Week 2 against the Lions, it was announced Monday.",https://www.espn.com/nfl/story/_/id/48744949/bills-play-first-regular-season-game-new-stadium-week-2,"Tue, 12 May 2026 07:27:27 EST"
nfl,Harbaugh-led Giants to host Cowboys in Week 1,"The Giants will host the Cowboys on Sept. 13 in the first ""Sunday Night Football"" game of the 2026 season.",https://www.espn.com/nfl/story/_/id/48740437/john-harbaugh-giants-host-cowboys-week-1-sunday-night-football,"Tue, 12 May 2026 07:27:27 EST"
nfl,"Sources: Chargers, TE Njoku agree to 1-yr. deal","After nine years with the Browns, David Njoku has agreed to terms with the Chargers on a one-year deal worth up to $8 million, sources told NFL Network's Ian Rapoport.",https://www.espn.com/nfl/story/_/id/48739754/sources-chargers-te-david-njoku-agree-one-year-deal,"Tue, 12 May 2026 07:27:27 EST"
nfl,Vikes surprise Peterson with Ring of Honor news,"Adrian Peterson will enter the Minnesota Vikings' ring of honor this fall, the team announced Monday.",https://www.espn.com/nfl/story/_/id/48741817/vikings-induct-ex-rb-adrian-peterson-ring-honor,"Tue, 12 May 2026 07:27:27 EST"
nfl,"Morton, SB starter for Cowboys and Broncos, dies","Craig Morton, who spent 18 years in the NFL and became the first quarterback to start the Super Bowl for two franchises -- the Dallas Cowboys and Denver Broncos -- died over the weekend at 83.",https://www.espn.com/nfl/story/_/id/48746277/craig-morton-super-bowl-starter-cowboys-broncos-dies,"Tue, 12 May 2026 07:27:27 EST"
nfl,"Steelers reward Boswell with 4-year, $28M deal","The Steelers have agreed to terms with kicker Chris Boswell on a four-year, $28 million extension, his agency, CAA Football, told ESPN's Adam Schefter.",https://www.espn.com/nfl/story/_/id/48742244/steelers-boswell-now-tied-aubrey-nfl-top-paid-kicker,"Tue, 12 May 2026 07:27:27 EST"
nfl,Bills boost pass-rush depth with ex-Chief Danna,"The Bills added a familiar former opponent to the roster, signing outside linebacker Mike Danna to a one-year deal Monday.",https://www.espn.com/nfl/story/_/id/48741642/bills-sign-ex-chiefs-pass-rusher-mike-danna-1-year-deal,"Tue, 12 May 2026 07:27:27 EST"
nfl,SB LIX dancer found guilty of resisting officer,"Zul-Qarnain Kwame Nantambu was found guilty of resisting an officer charge, a misdemeanor, after disrupting Kendrick Lamar's Super Bowl halftime performance with a flag that read ""Sudan and Free Gaza.""",https://www.espn.com/nfl/story/_/id/48745453/super-bowl-lix-performer-found-guilty-resisting-officer,"Tue, 12 May 2026 07:27:27 EST"
nfl,💍 Michael Penix Jr. marries fiancée Olivia Carter...,"The Atlanta Falcons quarterback seemed to be recovering well from his ACL surgery, showing off his moves on the dance floor.",https://www.espn.com/nfl/story/_/id/48713394/michael-penix-jr-olivia-carter-wedding-atlanta-falcons,"Tue, 12 May 2026 07:27:27 EST"
nfl,Three questions facing Lamar Jackson and the Raven...,"Heading into next week's organized team activities, the Ravens have some major questions to address.",https://www.espn.com/nfl/story/_/id/48741815/questions-facing-lamar-jackson-baltimore-ravens-ravens-center-tyler-linderbaum-nnamdi-madubuike,"Tue, 12 May 2026 07:27:34 EST"
nfl,The non-Round 1 impact rookies: Yates lists 20 sle...,"We picked out Day 2 and Day 3 NFL draft picks who could contribute right away, including R Mason Thomas and Antonio Williams.",https://www.espn.com/nfl/draft2026/story/_/id/48702987/2026-nfl-draft-rookie-year-impact-middle-late-rounders,"Mon, 11 May 2026 21:56:54 EST"
nfl,"Early NFL awards favorites, long shots: Which rook...","There's still a long way to go until the 2026 season kicks off, but it's never too early to see who's a front-runner.",https://www.espn.com/espn/betting/story/_/id/48687620/nfl-awards-offensive-rookie-year-coach-year-2026,"Mon, 11 May 2026 21:56:54 EST"
nfl,2026 NFL schedule: Everything we're hearing ahead ...,The Seahawks will open a season that features nine international games. Come back for bold predictions and more.,https://www.espn.com/nfl/story/_/page/nflschedulerelease-48704131/2026-nfl-schedule-release-bold-predictions-takeaways-revenge-games-all-32-teams,"Mon, 11 May 2026 16:12:21 EST"
nfl,The biggest remaining roster hole for every NFL te...,"Even after free agency, trades and the draft, NFL teams still have at least one position that needs a boost. Here's one for every roster.",https://www.espn.com/nfl/story/_/id/48649984/2026-nfl-offseason-biggest-roster-holes-depth-needs-all-32-teams-postdraft,"Mon, 11 May 2026 15:35:52 EST"
nfl,Who is on the hot seat after the NFL draft? 14 vet...,Will Carrington Valentine get jumped by Brandon Cisse on the Green Bay depth chart?,https://www.espn.com/nfl/story/_/id/48675818/2026-nfl-offseason-draft-veteran-hot-seats-position-battles-rookies,"Mon, 11 May 2026 15:35:52 EST"
