seccion,titulo,descripcion,enlace,fecha,desc_limpia,tokens,tokens_sin_stop,num_palabras,long_titulo
general,Takeaways from Thunder-Lakers Game 4,Here's what we've learned -- and what's next for the Cavs-Pistons and the Wolves-Spurs series.,https://www.espn.com/nba/story/_/id/48676289/2026-nba-playoffs-conference-semifinals-round-2-takeaways,"Tue, 12 May 2026 02:05:06 EST",heres what weve learned  and whats next for the cavspistons and the wolvesspurs series,"['heres', 'what', 'weve', 'learned', 'and', 'whats', 'next', 'for', 'the', 'cavspistons', 'and', 'the', 'wolvesspurs', 'series']","['heres', 'weve', 'learned', 'whats', 'next', 'cavspistons', 'wolvesspurs', 'series']",8,36
general,LeBron: 'I don't know what the future holds',"LeBron James, whose record-setting 23rd season ended with an unceremonious 115-110 loss to the Thunder in Game 4 of a second-round sweep of the Lakers, was noncommittal about whether he will continue playing in L.A. -- or elsewhere.",https://www.espn.com/nba/story/_/id/48747842/lakers-lebron-james-know-future-holds-me,"Tue, 12 May 2026 07:00:09 EST",lebron james whose recordsetting rd season ended with an unceremonious  loss to the thunder in game  of a secondround sweep of the lakers was noncommittal about whether he will continue playing in la  or elsewhere,"['lebron', 'james', 'whose', 'recordsetting', 'rd', 'season', 'ended', 'with', 'an', 'unceremonious', 'loss', 'to', 'the', 'thunder', 'in', 'game', 'of', 'a', 'secondround', 'sweep', 'of', 'the', 'lakers', 'was', 'noncommittal', 'about', 'whether', 'he', 'will', 'continue', 'playing', 'in', 'la', 'or', 'elsewhere']","['lebron', 'james', 'whose', 'recordsetting', 'season', 'ended', 'unceremonious', 'loss', 'thunder', 'game', 'secondround', 'sweep', 'lakers', 'noncommittal', 'whether', 'continue', 'playing', 'elsewhere']",18,44
general,OKC escapes late L.A. charge to complete sweep,"The Lakers refused to fold while facing elimination, but the Thunder ultimately pulled away to improve to 8-0 this postseason.",https://www.espn.com/nba/story/_/id/48747206/thunder-escape-late-lakers-charge-complete-sweep,"Tue, 12 May 2026 07:00:09 EST",the lakers refused to fold while facing elimination but the thunder ultimately pulled away to improve to  this postseason,"['the', 'lakers', 'refused', 'to', 'fold', 'while', 'facing', 'elimination', 'but', 'the', 'thunder', 'ultimately', 'pulled', 'away', 'to', 'improve', 'to', 'this', 'postseason']","['lakers', 'refused', 'fold', 'facing', 'elimination', 'thunder', 'ultimately', 'pulled', 'away', 'improve', 'postseason']",11,46
general,Bickerstaff calls FT disparity in loss 'unacceptab...,"Pistons coach J.B. Bickerstaff called the gulf in attempted free throws between his team and the Cavaliers in Monday's Game 4 loss ""unacceptable.""",https://www.espn.com/nba/story/_/id/48747058/bickerstaff-calls-ft-disparity-game-4-loss-unacceptable,"Tue, 12 May 2026 07:00:09 EST",pistons coach jb bickerstaff called the gulf in attempted free throws between his team and the cavaliers in mondays game  loss unacceptable,"['pistons', 'coach', 'jb', 'bickerstaff', 'called', 'the', 'gulf', 'in', 'attempted', 'free', 'throws', 'between', 'his', 'team', 'and', 'the', 'cavaliers', 'in', 'mondays', 'game', 'loss', 'unacceptable']","['pistons', 'coach', 'bickerstaff', 'called', 'gulf', 'attempted', 'free', 'throws', 'team', 'cavaliers', 'mondays', 'game', 'loss', 'unacceptable']",14,53
general,Mitchell's record-tying 2nd half evens East semis,"Donovan Mitchell tied an NBA playoff record with 39 points in the second half, and the Cavaliers evened their second-round series against the Pistons with a 112-103 victory Monday night.",https://www.espn.com/nba/story/_/id/48746487/donovan-mitchell-ties-nba-playoff-record-39-points-second-half-cavaliers-even-series-vs-pistons,"Tue, 12 May 2026 07:00:09 EST",donovan mitchell tied an nba playoff record with  points in the second half and the cavaliers evened their secondround series against the pistons with a  victory monday night,"['donovan', 'mitchell', 'tied', 'an', 'nba', 'playoff', 'record', 'with', 'points', 'in', 'the', 'second', 'half', 'and', 'the', 'cavaliers', 'evened', 'their', 'secondround', 'series', 'against', 'the', 'pistons', 'with', 'a', 'victory', 'monday', 'night']","['donovan', 'mitchell', 'tied', 'nba', 'playoff', 'record', 'points', 'second', 'half', 'cavaliers', 'evened', 'secondround', 'series', 'pistons', 'victory', 'monday', 'night']",17,49
general,Kiffin: LSU's 'diversity' recruiting edge vs. Rebe...,"LSU coach Lane Kiffin implied the lack of diversity at Ole Miss hurt his ability to recruit players, saying parents have told him Baton Rouge feels more reflective of the ""real world.""",https://www.espn.com/college-football/story/_/id/48744747/kiffin-lsu-diversity-recruitment-advantage-vs-ole-miss,"Tue, 12 May 2026 07:00:09 EST",lsu coach lane kiffin implied the lack of diversity at ole miss hurt his ability to recruit players saying parents have told him baton rouge feels more reflective of the real world,"['lsu', 'coach', 'lane', 'kiffin', 'implied', 'the', 'lack', 'of', 'diversity', 'at', 'ole', 'miss', 'hurt', 'his', 'ability', 'to', 'recruit', 'players', 'saying', 'parents', 'have', 'told', 'him', 'baton', 'rouge', 'feels', 'more', 'reflective', 'of', 'the', 'real', 'world']","['lsu', 'coach', 'lane', 'kiffin', 'implied', 'lack', 'diversity', 'ole', 'miss', 'hurt', 'ability', 'recruit', 'players', 'saying', 'parents', 'told', 'baton', 'rouge', 'feels', 'reflective', 'real', 'world']",22,53
general,Wild's McCarron labels Avs' Manson 'a dirty player...,Avalanche defenseman Josh Manson returned from a five-game absence Monday night in Game 4 and took a double minor penalty for hitting Wild center Michael McCarron with the blunt end of his stick during a scrum midway through the first period.,https://www.espn.com/nhl/story/_/id/48747287/wild-michael-mccarron-calls-avalanche-josh-manson-dirty-player-butt-ending-face,"Tue, 12 May 2026 07:00:09 EST",avalanche defenseman josh manson returned from a fivegame absence monday night in game  and took a double minor penalty for hitting wild center michael mccarron with the blunt end of his stick during a scrum midway through the first period,"['avalanche', 'defenseman', 'josh', 'manson', 'returned', 'from', 'a', 'fivegame', 'absence', 'monday', 'night', 'in', 'game', 'and', 'took', 'a', 'double', 'minor', 'penalty', 'for', 'hitting', 'wild', 'center', 'michael', 'mccarron', 'with', 'the', 'blunt', 'end', 'of', 'his', 'stick', 'during', 'a', 'scrum', 'midway', 'through', 'the', 'first', 'period']","['avalanche', 'defenseman', 'josh', 'manson', 'returned', 'fivegame', 'absence', 'monday', 'night', 'game', 'took', 'double', 'minor', 'penalty', 'hitting', 'wild', 'center', 'michael', 'mccarron', 'blunt', 'end', 'stick', 'scrum', 'midway', 'first', 'period']",26,53
general,Sources: Struggling Mets call up prospect Ewing,"The Mets are calling up their No. 2 prospect, outfielder A.J. Ewing, in hopes of sparking a struggling offense.",https://www.espn.com/mlb/story/_/id/48746188/sources-struggling-mets-call-prospect-aj-ewing,"Tue, 12 May 2026 07:00:09 EST",the mets are calling up their no  prospect outfielder aj ewing in hopes of sparking a struggling offense,"['the', 'mets', 'are', 'calling', 'up', 'their', 'no', 'prospect', 'outfielder', 'aj', 'ewing', 'in', 'hopes', 'of', 'sparking', 'a', 'struggling', 'offense']","['mets', 'calling', 'prospect', 'outfielder', 'ewing', 'hopes', 'sparking', 'struggling', 'offense']",9,47
general,Bills to open new stadium in Week 2 vs. Lions,"The Bills will play their first regular-season game at their new home, the newly constructed Highmark Stadium, in Week 2 against the Lions, it was announced Monday.",https://www.espn.com/nfl/story/_/id/48744949/bills-play-first-regular-season-game-new-stadium-week-2,"Tue, 12 May 2026 07:00:09 EST",the bills will play their first regularseason game at their new home the newly constructed highmark stadium in week  against the lions it was announced monday,"['the', 'bills', 'will', 'play', 'their', 'first', 'regularseason', 'game', 'at', 'their', 'new', 'home', 'the', 'newly', 'constructed', 'highmark', 'stadium', 'in', 'week', 'against', 'the', 'lions', 'it', 'was', 'announced', 'monday']","['bills', 'play', 'first', 'regularseason', 'game', 'new', 'home', 'newly', 'constructed', 'highmark', 'stadium', 'week', 'lions', 'announced', 'monday']",15,45
general,"⚾ MLB free agency: Skubal status, top hitter, more...",We polled those around the industry about the most intriguing topics surrounding this upcoming offseason.,https://www.espn.com/mlb/story/_/id/48733848/mlb-2026-27-free-agency-offseason-questions-market-skubal-lockout-top-free-agent,"Tue, 12 May 2026 07:00:09 EST",we polled those around the industry about the most intriguing topics surrounding this upcoming offseason,"['we', 'polled', 'those', 'around', 'the', 'industry', 'about', 'the', 'most', 'intriguing', 'topics', 'surrounding', 'this', 'upcoming', 'offseason']","['polled', 'around', 'industry', 'intriguing', 'topics', 'surrounding', 'upcoming', 'offseason']",8,53
general,"The French Connection: Gobert, Wemby put their friendship on hold for the playoffs",The French big men have been friends for a decade and now face off against each other in a 2-2 series.,https://www.espn.com/nba/story/_/id/48742665/rivalry-friendship-rudy-gobert-victor-wembanyama-spurs-timberwolves-playoffs,"Tue, 12 May 2026 07:07:48 EST",the french big men have been friends for a decade and now face off against each other in a  series,"['the', 'french', 'big', 'men', 'have', 'been', 'friends', 'for', 'a', 'decade', 'and', 'now', 'face', 'off', 'against', 'each', 'other', 'in', 'a', 'series']","['french', 'big', 'men', 'friends', 'decade', 'face', 'series']",7,82
general,"Lucky socks, a fishhook and pickup hoops: How the ...",ESPN was granted behind-the-scenes access to Washington on the day the franchise secured the No. 1 pick of the 2026 NBA draft.,https://www.espn.com/nba/story/_/id/48742366/washington-wizards-nba-lottery-draft-2026-first-overall-pick-aj-dybantsa,"Tue, 12 May 2026 08:05:27 EST",espn was granted behindthescenes access to washington on the day the franchise secured the no  pick of the  nba draft,"['espn', 'was', 'granted', 'behindthescenes', 'access', 'to', 'washington', 'on', 'the', 'day', 'the', 'franchise', 'secured', 'the', 'no', 'pick', 'of', 'the', 'nba', 'draft']","['espn', 'granted', 'behindthescenes', 'access', 'washington', 'day', 'franchise', 'secured', 'pick', 'nba', 'draft']",11,53
general,Windhorst: Everything I saw inside the NBA's myste...,Here's everything that transpired as the ping-pong balls were selected.,https://www.espn.com/nba/story/_/id/48737761/inside-secret-nba-lottery-room-ahead-2026-draft-picks-rounds-jokes-silence-ping-pong-balls,"Tue, 12 May 2026 08:05:26 EST",heres everything that transpired as the pingpong balls were selected,"['heres', 'everything', 'that', 'transpired', 'as', 'the', 'pingpong', 'balls', 'were', 'selected']","['heres', 'everything', 'transpired', 'pingpong', 'balls', 'selected']",6,53
general,"Wait, why didn't my NFL team ____? Reasonable answ...","Let's make sense of the Cowboys not extending George Pickens, the Steelers bypassing QB upgrades, the Dolphins not trading De'Von Achane and more.",https://www.espn.com/nfl/story/_/id/48742512/2026-nfl-offseason-10-teams-questions-explaining-missed-moves,"Tue, 12 May 2026 07:14:23 EST",lets make sense of the cowboys not extending george pickens the steelers bypassing qb upgrades the dolphins not trading devon achane and more,"['lets', 'make', 'sense', 'of', 'the', 'cowboys', 'not', 'extending', 'george', 'pickens', 'the', 'steelers', 'bypassing', 'qb', 'upgrades', 'the', 'dolphins', 'not', 'trading', 'devon', 'achane', 'and', 'more']","['lets', 'make', 'sense', 'cowboys', 'extending', 'george', 'pickens', 'steelers', 'bypassing', 'upgrades', 'dolphins', 'trading', 'devon', 'achane']",14,53
general,Three questions facing Lamar Jackson and the Raven...,"Heading into next week's organized team activities, the Ravens have some major questions to address.",https://www.espn.com/nfl/story/_/id/48741815/questions-facing-lamar-jackson-baltimore-ravens-ravens-center-tyler-linderbaum-nnamdi-madubuike,"Tue, 12 May 2026 07:14:23 EST",heading into next weeks organized team activities the ravens have some major questions to address,"['heading', 'into', 'next', 'weeks', 'organized', 'team', 'activities', 'the', 'ravens', 'have', 'some', 'major', 'questions', 'to', 'address']","['heading', 'next', 'weeks', 'organized', 'team', 'activities', 'ravens', 'major', 'questions', 'address']",10,53
general,Rich Rodriguez Q&A: The secret sauce at West Virgi...,"At his second go-around in Morgantown, Rodriguez notes how much has changed and what's stayed the same.",https://www.espn.com/college-football/story/_/id/48679548/west-virginia-rich-rodriguez-qa-college-football,"Tue, 12 May 2026 07:08:21 EST",at his second goaround in morgantown rodriguez notes how much has changed and whats stayed the same,"['at', 'his', 'second', 'goaround', 'in', 'morgantown', 'rodriguez', 'notes', 'how', 'much', 'has', 'changed', 'and', 'whats', 'stayed', 'the', 'same']","['second', 'goaround', 'morgantown', 'rodriguez', 'notes', 'much', 'changed', 'whats', 'stayed']",9,53
general,"CFB buzz: Army-Navy's future, last JMU Hoosier, la...",What we heard around college football after the completion of spring practice.,https://www.espn.com/college-football/story/_/id/48695281/college-football-spring-buzz-week-0-cfp-ohio-state-notre-dame-army-navy,"Tue, 12 May 2026 07:08:21 EST",what we heard around college football after the completion of spring practice,"['what', 'we', 'heard', 'around', 'college', 'football', 'after', 'the', 'completion', 'of', 'spring', 'practice']","['heard', 'around', 'college', 'football', 'completion', 'spring', 'practice']",7,53
general,Why so many good teams have closer issues -- and h...,"Bullpens are more volatile than ever, and closers with a capital C are few and far between, even for baseball's elite.",https://www.espn.com/mlb/story/_/id/48742800/mlb-2026-closer-bullpen-struggles-impact-rest-season-deadline,"Tue, 12 May 2026 07:11:47 EST",bullpens are more volatile than ever and closers with a capital c are few and far between even for baseballs elite,"['bullpens', 'are', 'more', 'volatile', 'than', 'ever', 'and', 'closers', 'with', 'a', 'capital', 'c', 'are', 'few', 'and', 'far', 'between', 'even', 'for', 'baseballs', 'elite']","['bullpens', 'volatile', 'ever', 'closers', 'capital', 'far', 'even', 'baseballs', 'elite']",9,53
general,How two lefty sluggers are powering the best offen...,Matt Olson and Drake Baldwin headline a lineup that has the Braves running away with the NL East.,https://www.espn.com/mlb/story/_/id/48742605/mlb-2026-matt-olson-drake-baldwin-atlanta-braves-lineup-offsense-nl-east,"Tue, 12 May 2026 07:11:47 EST",matt olson and drake baldwin headline a lineup that has the braves running away with the nl east,"['matt', 'olson', 'and', 'drake', 'baldwin', 'headline', 'a', 'lineup', 'that', 'has', 'the', 'braves', 'running', 'away', 'with', 'the', 'nl', 'east']","['matt', 'olson', 'drake', 'baldwin', 'headline', 'lineup', 'braves', 'running', 'away', 'east']",10,53
general,"PGA Championship tiers: Ranking favorites, contend...",Can Scottie Scheffler repeat? Will Rory McIlroy make it two straight majors? We break down the PGA Championship field from the favorites to the players just looking to make the cut.,https://www.espn.com/golf/story/_/page/PGArankings2026/2026-pga-championship-ranking-favorites-contenders-hopefuls,"Tue, 12 May 2026 06:40:29 EST",can scottie scheffler repeat will rory mcilroy make it two straight majors we break down the pga championship field from the favorites to the players just looking to make the cut,"['can', 'scottie', 'scheffler', 'repeat', 'will', 'rory', 'mcilroy', 'make', 'it', 'two', 'straight', 'majors', 'we', 'break', 'down', 'the', 'pga', 'championship', 'field', 'from', 'the', 'favorites', 'to', 'the', 'players', 'just', 'looking', 'to', 'make', 'the', 'cut']","['scottie', 'scheffler', 'repeat', 'rory', 'mcilroy', 'make', 'two', 'straight', 'majors', 'break', 'pga', 'championship', 'field', 'favorites', 'players', 'looking', 'make', 'cut']",18,53
general,"Latest news and analysis, how to watch and more fr...",The PGA Championship heads to Aronimink Golf Club outside of Philadelphia. Here's all the coverage.,https://www.espn.com/golf/story/_/page/PGAchampionship2026/pga-championship-2026-news-tee-s-schedule-television-complete-coverage-analysis,"Mon, 11 May 2026 14:14:23 EST",the pga championship heads to aronimink golf club outside of philadelphia heres all the coverage,"['the', 'pga', 'championship', 'heads', 'to', 'aronimink', 'golf', 'club', 'outside', 'of', 'philadelphia', 'heres', 'all', 'the', 'coverage']","['pga', 'championship', 'heads', 'aronimink', 'golf', 'club', 'outside', 'philadelphia', 'heres', 'coverage']",10,53
general,'Blast from the past': How Taylor Hall found his M...,"The No. 1 pick (2010) and Hart Trophy winner (2018) is a critical player for the Canes, who have yet to lose this postseason.",https://www.espn.com/nhl/story/_/id/48743578/2026-nhl-playoffs-stanley-cup-taylor-hall-mvp-carolina-hurricanes,"Tue, 12 May 2026 07:07:36 EST",the no  pick  and hart trophy winner  is a critical player for the canes who have yet to lose this postseason,"['the', 'no', 'pick', 'and', 'hart', 'trophy', 'winner', 'is', 'a', 'critical', 'player', 'for', 'the', 'canes', 'who', 'have', 'yet', 'to', 'lose', 'this', 'postseason']","['pick', 'hart', 'trophy', 'winner', 'critical', 'player', 'canes', 'yet', 'lose', 'postseason']",10,53
general,"Stanley Cup playoffs daily: Sabres want revenge, p...","It's a crucial night on the calendar with an ESPN doubleheader. Plus, highlights from Avs-Wild Game 4.",https://www.espn.com/nhl/story/_/id/48526483/2026-nhl-playoffs-stanley-cup-preview-stats-schedule-top-players-bracket-matchups,"Tue, 12 May 2026 07:21:57 EST",its a crucial night on the calendar with an espn doubleheader plus highlights from avswild game ,"['its', 'a', 'crucial', 'night', 'on', 'the', 'calendar', 'with', 'an', 'espn', 'doubleheader', 'plus', 'highlights', 'from', 'avswild', 'game']","['crucial', 'night', 'calendar', 'espn', 'doubleheader', 'plus', 'highlights', 'avswild', 'game']",9,53
general,10 things we learned from the WNBA's opening weeke...,"Even with a short roster, New York is a front-runner, Phoenix has no shortage of talent, and the Dream are even better.",https://www.espn.com/wnba/story/_/id/48736313/wnba-2026-season-opener-takeaways-caitlin-clark-fever-wings-liberty-aces,"Mon, 11 May 2026 11:50:43 EST",even with a short roster new york is a frontrunner phoenix has no shortage of talent and the dream are even better,"['even', 'with', 'a', 'short', 'roster', 'new', 'york', 'is', 'a', 'frontrunner', 'phoenix', 'has', 'no', 'shortage', 'of', 'talent', 'and', 'the', 'dream', 'are', 'even', 'better']","['even', 'short', 'roster', 'new', 'york', 'frontrunner', 'phoenix', 'shortage', 'talent', 'dream', 'even', 'better']",12,53
general,How Belmont's Maya Johnson managed lupus to become...,"The Bruins ace was turned away by major programs for medical reasons. Now, in the postseason, she's looking to beat them.",https://www.espn.com/college-sports/story/_/id/48740541/belmont-softball-maya-johnson-lupus,"Tue, 12 May 2026 07:09:52 EST",the bruins ace was turned away by major programs for medical reasons now in the postseason shes looking to beat them,"['the', 'bruins', 'ace', 'was', 'turned', 'away', 'by', 'major', 'programs', 'for', 'medical', 'reasons', 'now', 'in', 'the', 'postseason', 'shes', 'looking', 'to', 'beat', 'them']","['bruins', 'ace', 'turned', 'away', 'major', 'programs', 'medical', 'reasons', 'postseason', 'shes', 'looking', 'beat']",12,53
general,Why a familiar summer awaits Joel Embiid and the 7...,"After a historic comeback gave way to a second-round sweep, the 76ers face another offseason of questions.",https://www.espn.com/nba/story/_/id/48622748/nba-playoffs-2026-embiid-76ers-face-familiar-offseason-knicks-sweep,"Mon, 11 May 2026 16:34:19 EST",after a historic comeback gave way to a secondround sweep the ers face another offseason of questions,"['after', 'a', 'historic', 'comeback', 'gave', 'way', 'to', 'a', 'secondround', 'sweep', 'the', 'ers', 'face', 'another', 'offseason', 'of', 'questions']","['historic', 'comeback', 'gave', 'way', 'secondround', 'sweep', 'ers', 'face', 'another', 'offseason', 'questions']",11,53
general,As it happened: Washington wins the No. 1 pick in the NBA 2026 draft lottery,Here is how the NBA 2026 draft lottery unfolded from Chicago on Sunday as the Wizards won the No. 1 pick.,https://www.espn.com/nba/story/_/id/48706896/nba-draft-lottery-2026-live-updates-moments,"Sun, 10 May 2026 15:49:57 EST",here is how the nba  draft lottery unfolded from chicago on sunday as the wizards won the no  pick,"['here', 'is', 'how', 'the', 'nba', 'draft', 'lottery', 'unfolded', 'from', 'chicago', 'on', 'sunday', 'as', 'the', 'wizards', 'won', 'the', 'no', 'pick']","['nba', 'draft', 'lottery', 'unfolded', 'chicago', 'sunday', 'wizards', 'pick']",8,76
general,Inside Real Madrid's downward spiral into infighti...,"In another season with no major trophy, Real Madrid have had to deal with players fighting and problems at team and boardroom level. How did it come to this?",https://www.espn.com/soccer/story/_/id/48739869/real-madrid-downward-spiral-infighting-disarray-no-trophies,"Tue, 12 May 2026 07:24:07 EST",in another season with no major trophy real madrid have had to deal with players fighting and problems at team and boardroom level how did it come to this,"['in', 'another', 'season', 'with', 'no', 'major', 'trophy', 'real', 'madrid', 'have', 'had', 'to', 'deal', 'with', 'players', 'fighting', 'and', 'problems', 'at', 'team', 'and', 'boardroom', 'level', 'how', 'did', 'it', 'come', 'to', 'this']","['another', 'season', 'major', 'trophy', 'real', 'madrid', 'deal', 'players', 'fighting', 'problems', 'team', 'boardroom', 'level', 'come']",14,53
general,"How Barcelona won LaLiga title, and how they can g...","It will be hard to top sealing the title in El Clásico, but 2025-26 is a season that has left Barcelona wanting more.",https://www.espn.com/soccer/story/_/id/48739456/how-barcelona-won-laliga-how-get-even-better,"Tue, 12 May 2026 07:24:06 EST",it will be hard to top sealing the title in el clsico but  is a season that has left barcelona wanting more,"['it', 'will', 'be', 'hard', 'to', 'top', 'sealing', 'the', 'title', 'in', 'el', 'clsico', 'but', 'is', 'a', 'season', 'that', 'has', 'left', 'barcelona', 'wanting', 'more']","['hard', 'top', 'sealing', 'title', 'clsico', 'season', 'left', 'barcelona', 'wanting']",9,53
general,"Hat trick: Alex Morgan pregnant with third baby, e...","Former USWNT star Alex Morgan announced on Mother's Day that she and her partner, Servando Carrasco, are expecting their third child together.",https://www.espn.com/soccer/story/_/id/48738086/alex-morgan-third-baby-announcement-pregnancy,"Mon, 11 May 2026 23:46:10 EST",former uswnt star alex morgan announced on mothers day that she and her partner servando carrasco are expecting their third child together,"['former', 'uswnt', 'star', 'alex', 'morgan', 'announced', 'on', 'mothers', 'day', 'that', 'she', 'and', 'her', 'partner', 'servando', 'carrasco', 'are', 'expecting', 'their', 'third', 'child', 'together']","['former', 'uswnt', 'star', 'alex', 'morgan', 'announced', 'mothers', 'day', 'partner', 'servando', 'carrasco', 'expecting', 'third', 'child', 'together']",15,53
general,Celebrities at the NBA playoffs: Leonardo DiCaprio...,Celebrities have been out in style courtside at the NBA playoffs.,https://www.espn.com/nba/story/_/id/48514336/nba-playoffs-2026-celebrity-sightings,"Mon, 11 May 2026 23:46:10 EST",celebrities have been out in style courtside at the nba playoffs,"['celebrities', 'have', 'been', 'out', 'in', 'style', 'courtside', 'at', 'the', 'nba', 'playoffs']","['celebrities', 'style', 'courtside', 'nba', 'playoffs']",5,53
general,UFC 328 fight grades: Khamzat Chimaev vs. Sean Str...,"There were seven finishes on the UFC 328 card, but only one of them earned an A grade.",https://www.espn.com/mma/story/_/id/48736888/ufc-328-fight-grades-sean-strickland-khamzat-chimaev-joshua-van-tatsuro-taira,"Mon, 11 May 2026 12:36:39 EST",there were seven finishes on the ufc  card but only one of them earned an a grade,"['there', 'were', 'seven', 'finishes', 'on', 'the', 'ufc', 'card', 'but', 'only', 'one', 'of', 'them', 'earned', 'an', 'a', 'grade']","['seven', 'finishes', 'ufc', 'card', 'one', 'earned', 'grade']",7,53
general,What's next: Will Sean Strickland and Khamzat Chim...,"The most-likely next opponent -- and a few wild cards -- for the winners, losers from the UFC 328 main card.",https://www.espn.com/mma/story/_/id/48728899/ufc-328-whats-next-sean-strickland-khamzat-chimaev-run-back,"Mon, 11 May 2026 12:36:39 EST",the mostlikely next opponent  and a few wild cards  for the winners losers from the ufc  main card,"['the', 'mostlikely', 'next', 'opponent', 'and', 'a', 'few', 'wild', 'cards', 'for', 'the', 'winners', 'losers', 'from', 'the', 'ufc', 'main', 'card']","['mostlikely', 'next', 'opponent', 'wild', 'cards', 'winners', 'losers', 'ufc', 'main', 'card']",10,53
general,"Week 13 in college baseball: Top 25, best moments ...",What do the latest top 25 rankings look like?,https://www.espn.com/college-sports/story/_/id/48740731/college-baseball-week-13-top-25-rankings-top-player-game-watch-2026,"Mon, 11 May 2026 15:52:21 EST",what do the latest top  rankings look like,"['what', 'do', 'the', 'latest', 'top', 'rankings', 'look', 'like']","['latest', 'top', 'rankings', 'look', 'like']",5,53
