seccion,titulo,descripcion,enlace,fecha
nfl,Fantasy buzz: Which players benefit most from Njok...,"Discussing the impact on Oronde Gadsden, Kyler Murray, Justin Jefferson, Jordan Addison and others this season.",https://www.espn.com/fantasy/football/story/_/id/40699880/fantasy-football-injuries-position-battles-nfl-news-analysis,"Mon, 11 May 2026 11:12:51 EST"
nfl,Field Yates' rankings: PPR top 160,"Field provides his latest rankings for the upcoming season, which will be updated throughout the offseason.",https://www.espn.com/fantasy/football/story/_/id/48711830/2026-fantasy-football-rankings-ppr-field-yates,"Mon, 11 May 2026 11:12:51 EST"
nfl,"Baby No. 2 on the way for Christian McCaffrey, Oli...",The San Francisco 49ers star and former Miss Universe announced that they are expecting their second child.,https://www.espn.com/nfl/story/_/id/48717338/christian-mccaffrey-olivia-culpo-second-baby-announcement,"Fri, 8 May 2026 23:34:31 EST"
nfl,Justin Herbert stars in girlfriend Madison Beer's ...,The Grammy-nominated artist and the Chargers quarterback share the screen together in the video.,https://www.espn.com/nfl/story/_/id/48696952/justin-berbert-los-angeles-chargers-madison-beer-music-video-teaser,"Fri, 8 May 2026 23:34:31 EST"
nfl,"Super Bowl 2027 on ESPN: Date, location, venue, more details",The 2027 Super Bowl will air on ESPN for the first time in network history. Learn more information about Super Bowl LXI festivities now.,https://www.espn.com/nfl/story/_/id/47819308/super-bowl-2027-espn-how-watch-schedule-facts-stats,"Thu, 19 Feb 2026 08:05:38 EST"
mlb,Why so many good teams have closer issues -- and h...,"Bullpens are more volatile than ever, and closers with a capital C are few and far between, even for baseball's elite.",https://www.espn.com/mlb/story/_/id/48742800/mlb-2026-closer-bullpen-struggles-impact-rest-season-deadline,"Tue, 12 May 2026 07:33:51 EST"
mlb,The American League standings are ... weird. Here'...,We break down the wild state of the Junior Circuit.,https://www.espn.com/mlb/story/_/id/48712239/mlb-2026-american-league-al-standings-history-weird-yankees-rays,"Tue, 12 May 2026 07:33:51 EST"
mlb,Sources: Struggling Mets call up prospect Ewing,"The Mets are calling up their No. 2 prospect, outfielder A.J. Ewing, in hopes of sparking a struggling offense.",https://www.espn.com/mlb/story/_/id/48746188/sources-struggling-mets-call-prospect-aj-ewing,"Tue, 12 May 2026 07:34:04 EST"
mlb,Betts rejoins Dodgers after five weeks on IL,"Mookie Betts returned from the IL after a five-week absence on Monday, with the Dodgers hoping he can help spark a sluggish offense.",https://www.espn.com/mlb/story/_/id/48745756/mookie-betts-rejoins-dodgers-five-weeks-il,"Tue, 12 May 2026 07:34:04 EST"
mlb,Rangers scratch Eovaldi due to side tightness,Rangers right-hander Nathan Eovaldi was scratched from his scheduled start Monday against the Diamondbacks night because of left side tightness.,https://www.espn.com/mlb/story/_/id/48744303/rangers-nathan-eovaldi-face-d-backs-due-tight-side,"Tue, 12 May 2026 07:34:05 EST"
mlb,"Weathers loses no-no in 7th, then Yanks lose game","First, Ryan Weathers lost his no-hit bid. Not long after that, the Yankees lost the lead, eventually falling to the Orioles 3-2 in their fourth straight defeat.",https://www.espn.com/mlb/story/_/id/48746693/ryan-weathers-loses-no-hit-bid-yankees-lose-game-os,"Tue, 12 May 2026 07:34:05 EST"
mlb,Braves' Kim set for '26 debut; White to 7-day IL,"Braves shortstop Ha-Seong Kim was activated from the IL, clearing the way for his season debut, while Eli White was placed on the seven-day concussion IL.",https://www.espn.com/mlb/story/_/id/48744063/braves-activate-ha-seong-kim-put-eli-white-concussion-list,"Tue, 12 May 2026 07:34:04 EST"
mlb,Jays' Barger (elbow) to IL after 101.2 mph assist,The Blue Jays put outfielder Addison Barger back on the injured list with right elbow inflammation and designated left-handed pitcher Eric Lauer for assignment.,https://www.espn.com/mlb/story/_/id/48743608/blue-jays-addison-barger-returns-il-elbow-inflammation,"Tue, 12 May 2026 07:34:05 EST"
mlb,Yankees hope SS Caballero (finger) can avoid IL,Yankees shortstop José Caballero has been sidelined with a sore right middle finger and will undergo tests to determine the extent of the injury.,https://www.espn.com/mlb/story/_/id/48744400/yankees-jose-caballero-get-testing-injured-finger,"Tue, 12 May 2026 07:34:04 EST"
mlb,Diamondbacks' Santana suffers setback in rehab,"Diamondbacks first baseman Carlos Santana, the oldest active position player in the majors, suffered a recent setback in his rehab from a right groin strain that has sidelined him since April 5.",https://www.espn.com/mlb/story/_/id/48744772/diamondbacks-carlos-santana-suffers-setback-injury-rehab,"Tue, 12 May 2026 07:34:05 EST"
mlb,⚾ A May trade!? Grading Guardians-Giants deal,Cleveland acquired an elite defensive catcher from San Francisco. Which side fared best in the surprising swap?,https://www.espn.com/mlb/story/_/id/48722469/mlb-2026-trade-grades-patrick-bailey-cleveland-guardians-san-francisco-giants-report-card,"Tue, 12 May 2026 07:34:04 EST"
mlb,How two lefty sluggers are powering the best offense in baseball,Veteran All-Star Matt Olson and reigning Rookie of the Year Drake Baldwin headline a lineup that has the Braves running away with the NL East.,https://www.espn.com/mlb/story/_/id/48742605/mlb-2026-matt-olson-drake-baldwin-atlanta-braves-lineup-offsense-nl-east,"Tue, 12 May 2026 06:37:13 EST"
mlb,"Skubal's injury impact, lockout effects and more: ...",We polled those around the industry about the most intriguing topics surrounding this upcoming offseason.,https://www.espn.com/mlb/story/_/id/48733848/mlb-2026-27-free-agency-offseason-questions-market-skubal-lockout-top-free-agent,"Mon, 11 May 2026 22:04:43 EST"
mlb,Who can keep the Dodgers from three-peating? We id...,We make the case for the biggest threats to L.A.'s three-peat hopes.,https://www.espn.com/mlb/story/_/id/48702612/mlb-2026-teams-beat-dodgers-threepeat-braves-yankees-cubs-pirates-phillies-mariners,"Sat, 9 May 2026 00:41:19 EST"
mlb,Free agent pickups: Waldschmidt and Snelling get t...,The top players you should consider claiming off the fantasy baseball waiver wire this week.,https://www.espn.com/fantasy/baseball/story/_/id/48740286/fantasy-baseball-free-agent-pickups-waiver-wire-may11-2026,"Mon, 11 May 2026 11:31:33 EST"
mlb,Betts back for Dodgers and other Monday news to kn...,All of the important fantasy spin and actionable takeaways resulting from the latest baseball news.,https://www.espn.com/fantasy/baseball/story/_/id/48297021/espn-fantasy-baseball-buzz-injuries-promotions-demotions-trades-prospects-lineup-changes-mlb-news-analysis-2026,"Mon, 11 May 2026 11:31:33 EST"
mlb,Every team's odds to win the 2026 World Series: Do...,"Every MLB team's odds to win the 2026 World Series, led by the Dodgers with the slumping Mets way down the list.",https://www.espn.com/espn/betting/story/_/id/46793185/espn-mlb-betting-odds-futures-bets-world-series-american-national-league,"Mon, 11 May 2026 14:49:02 EST"
mlb,"MLB awards: Ohtani, Judge continue to lead MVP odd...","Here are the odds for MVP, Cy Young and Rookie of the Year in the AL and NL.",https://www.espn.com/espn/betting/story/_/id/48350446/2026-mlb-awards-sports-betting-odds-tracker-mvp-cy-young-rookie-year,"Mon, 11 May 2026 14:49:02 EST"
